questionID,originalQuestionID,totalPossiblePoint,AnswerKey,isMultipleChoiceQuestion,includesDiagram,examName,schoolGrade,year,question,subject,category
NYSEDREGENTS_2004_8_10,10,1,3,1,1,NYSEDREGENTS,8,2004,Which graph best represents the relationship between the amount of pollutants in the air and the quality of the air? (1) {img:images/NYSEDREGENTS/2004_8th_Grade/05.PNG} (2) {img:images/NYSEDREGENTS/2004_8th_Grade/06.PNG} (3) {img:images/NYSEDREGENTS/2004_8th_Grade/07.PNG} (4) {img:images/NYSEDREGENTS/2004_8th_Grade/08.PNG},,Train
NYSEDREGENTS_2004_8_11,11,1,3,1,1,NYSEDREGENTS,8,2004,The eyes of the owl and the rabbit shown in the diagram below give each animal a different advantage. The front-facing owl eyes allow the bird to accurately judge distance when swooping in on prey. The side-facing rabbit eyes allow the animal to detect the motion of possible predators. {img:images/NYSEDREGENTS/2004_8th_Grade/09.PNG} The specialized eye types of these animals are examples of (1) disruptions of the natural balance (2) the interdependence of living things (3) adaptations for survival under certain conditions (4) involuntary responses to stimuli,,Train
NYSEDREGENTS_2004_8_16,16,1,2,1,1,NYSEDREGENTS,8,2004,The diagram below shows a student making a wet-mount slide. {img:images/NYSEDREGENTS/2004_8th_Grade/10.PNG} Why should the student make sure the edge of the coverslip touches the drop of water before setting the coverslip onto the slide? (1) to increase evaporation (2) to reduce air bubbles (3) to clean the slide (4) to prevent the coverslip from breaking,,Train
NYSEDREGENTS_2004_8_18,18,1,3,1,1,NYSEDREGENTS,8,2004,Base your answers on the diagram below. The diagram shows the offspring of a white mouse and a gray mouse. All of the offspring are gray. {img:images/NYSEDREGENTS/2004_8th_Grade/11.PNG} Which is a correct gene combination for the parents shown in the diagram? (1) GG x GG (2) gg x gg (3) gg x GG (4) Gg x Gg,,Train
NYSEDREGENTS_2004_8_19,19,1,1,1,1,NYSEDREGENTS,8,2004,"Base your answers on the diagram below. The diagram shows the offspring of a white mouse and a gray mouse. All of the offspring are gray. {img:images/NYSEDREGENTS/2004_8th_Grade/11.PNG} If two gray (Gg) mice mated, what percent of their offspring would have pure white fur? (1) 25% (2) 50% (3) 75% (4) 100%",,Train
NYSEDREGENTS_2004_8_2,2,1,2,1,1,NYSEDREGENTS,8,2004,Which of the organisms shown below consists of only one cell? {img:images/NYSEDREGENTS/2004_8th_Grade/01.PNG} (1) pine tree (2) ameba (3) mushroom (4) earthworm,,Train
NYSEDREGENTS_2004_8_20,20,1,3,1,1,NYSEDREGENTS,8,2004,The diagrams below show the plant communities present in the same area at different times over a 200-year period following a forest fire. {img:images/NYSEDREGENTS/2004_8th_Grade/12.PNG} What is the correct sequence of these plant communities following the forest fire? (1) B -> A -> D -> C (2) B -> C -> D -> A (3) B -> D -> C -> A (4) B -> A -> C -> D,,Train
NYSEDREGENTS_2004_8_21,21,1,2,1,1,NYSEDREGENTS,8,2004,Base your answers on the diagram below and on your knowledge of science. The diagram below shows some relationships within a natural community. {img:images/NYSEDREGENTS/2004_8th_Grade/16.PNG} Which statement best explains the relationships shown? (1) Water changes over time to a nonrenewable resource. (2) Living things exchange materials with their environment. (3) Minerals recycle the dead materials in the environment. (4) Living things produce other living things.,,Train
NYSEDREGENTS_2004_8_22,22,1,4,1,1,NYSEDREGENTS,8,2004,Base your answers on the diagram below and on your knowledge of science. The diagram below shows some relationships within a natural community. {img:images/NYSEDREGENTS/2004_8th_Grade/16.PNG} Which process produces oxygen that is released into the atmosphere? (1) respiration (2) locomotion (3) excretion (4) photosynthesis,,Train
NYSEDREGENTS_2004_8_23,23,1,4,1,1,NYSEDREGENTS,8,2004,The weather map below shows the locations of a warm and a cold front over part of North America. {img:images/NYSEDREGENTS/2004_8th_Grade/17.PNG} The numbered lines on the weather map connect locations with the same (1) wind direction (2) wind speed (3) air temperature (4) air pressure,,Train
NYSEDREGENTS_2004_8_24,24,1,1,1,1,NYSEDREGENTS,8,2004,"Which graph best represents the relative distance between the particles of most substances in their solid, liquid, and gas states? {img:images/NYSEDREGENTS/2004_8th_Grade/18.PNG} (1) {img:images/NYSEDREGENTS/2004_8th_Grade/19.PNG} (2) {img:images/NYSEDREGENTS/2004_8th_Grade/20.PNG} (3) {img:images/NYSEDREGENTS/2004_8th_Grade/21.PNG} (4) {img:images/NYSEDREGENTS/2004_8th_Grade/22.PNG}",,Train
NYSEDREGENTS_2004_8_26,26,1,2,1,1,NYSEDREGENTS,8,2004,"Base your answers on the chart below, which shows various data collected and predicted for Albany, New York, on March 9, 2001. {img:images/NYSEDREGENTS/2004_8th_Grade/23.PNG} The chart shows information about Moon phases, times of sunrise and sunset, and (1) climate patterns (2) local weather conditions (3) seasonal changes (4) global warming",,Train
NYSEDREGENTS_2004_8_27,27,1,3,1,1,NYSEDREGENTS,8,2004,"Base your answers on the chart below, which shows various data collected and predicted for Albany, New York, on March 9, 2001. {img:images/NYSEDREGENTS/2004_8th_Grade/23.PNG} Which diagram correctly shows the position of the Moon with respect to Earth on March 9, 2001? (1) {img:images/NYSEDREGENTS/2004_8th_Grade/24.PNG} (2) {img:images/NYSEDREGENTS/2004_8th_Grade/25.PNG} (3) {img:images/NYSEDREGENTS/2004_8th_Grade/26.PNG} (4) {img:images/NYSEDREGENTS/2004_8th_Grade/27.PNG}",,Train
NYSEDREGENTS_2004_8_28,28,1,1,1,1,NYSEDREGENTS,8,2004,"Base your answers on the chart below, which shows various data collected and predicted for Albany, New York, on March 9, 2001. {img:images/NYSEDREGENTS/2004_8th_Grade/23.PNG} Which instrument dial shows a correct airpressure reading for Albany, New York, for this date and time? (1) {img:images/NYSEDREGENTS/2004_8th_Grade/28.PNG} (2) {img:images/NYSEDREGENTS/2004_8th_Grade/29.PNG} (3) {img:images/NYSEDREGENTS/2004_8th_Grade/30.PNG} (4) {img:images/NYSEDREGENTS/2004_8th_Grade/31.PNG}",,Train
NYSEDREGENTS_2004_8_29,29,1,1,1,1,NYSEDREGENTS,8,2004,The diagram below shows a ball held in place by two blocks. The diameter (width) of the ball is shown between the two blocks. {img:images/NYSEDREGENTS/2004_8th_Grade/32.PNG} What is the diameter of the ball? (1) 6.0 cm (2) 8.0 cm (3) 14.0 cm (4) 17.0 cm,,Train
NYSEDREGENTS_2004_8_30,30,1,1,1,1,NYSEDREGENTS,8,2004,The diagram below shows Earth as viewed from space. {img:images/NYSEDREGENTS/2004_8th_Grade/33.PNG} Which season is occurring in the Northern Hemisphere? (1) summer (2) autumn (3) winter (4) spring,,Train
NYSEDREGENTS_2004_8_32,32,1,4,1,1,NYSEDREGENTS,8,2004,The bold line on the map below shows the San Andreas Fault. {img:images/NYSEDREGENTS/2004_8th_Grade/34.PNG} The San Andreas Fault is the result of (1) overpopulation (2) a large glacier (3) weathering and erosion (4) crustal plate movement,,Train
NYSEDREGENTS_2004_8_33,33,1,3,1,1,NYSEDREGENTS,8,2004,Four identical sand castles are shown below. Which sand castle will most likely be eroded fastest by the wind? (1) {img:images/NYSEDREGENTS/2004_8th_Grade/35.PNG} (2) {img:images/NYSEDREGENTS/2004_8th_Grade/36.PNG} (3) {img:images/NYSEDREGENTS/2004_8th_Grade/37.PNG} (4) {img:images/NYSEDREGENTS/2004_8th_Grade/38.PNG},,Train
NYSEDREGENTS_2004_8_34,34,1,2,1,1,NYSEDREGENTS,8,2004,The diagram below shows a boulder rolling down a hill into a valley and then up the opposite hill. {img:images/NYSEDREGENTS/2004_8th_Grade/39.PNG} At which position does the boulder have the greatest kinetic energy? (1) A (2) B (3) C (4) D,,Train
NYSEDREGENTS_2004_8_35,35,1,2,1,1,NYSEDREGENTS,8,2004,"Base your answers on the graph below, which shows the solubility (amount that will dissolve in 100 grams of water) of three substances at various water temperatures. {img:images/NYSEDREGENTS/2004_8th_Grade/40.PNG} Which statement is a correct interpretation of the data in the graph? (1) As water temperature increases, solubility decreases. (2) As water temperature increases, solubility increases. (3) As water temperature increases, solubility increases and then decreases. (4) As water temperature increases, solubility decreases and then increases.",,Train
NYSEDREGENTS_2004_8_36,36,1,1,1,1,NYSEDREGENTS,8,2004,"Base your answers on the graph below, which shows the solubility (amount that will dissolve in 100 grams of water) of three substances at various water temperatures. {img:images/NYSEDREGENTS/2004_8th_Grade/40.PNG} As the water temperature is increased from 30°C to 70°C, how many more grams of substance A will dissolve in 100 grams of water? (1) 20 g (2) 40 g (3) 50 g (4) 90 g",,Train
NYSEDREGENTS_2004_8_38,38,1,3,1,1,NYSEDREGENTS,8,2004,"The diagram below shows a light ray. {img:images/NYSEDREGENTS/2004_8th_Grade/41.PNG} In this diagram, the light ray is being (1) transmitted (2) absorbed (3) reflected (4) refracted",,Train
NYSEDREGENTS_2004_8_39,39,1,1,1,1,NYSEDREGENTS,8,2004,"The picture below shows a ringing bell inside a vacuum jar. {img:images/NYSEDREGENTS/2004_8th_Grade/42.PNG} As air is pumped from the vacuum jar, the sound level of the ringing bell will decrease until it can no longer be heard. This happens because air must be present in the jar in order for (1) sound to be transferred (2) electricity to flow through the wires (3) the rubber to seal the jar (4) the bell clanger to vibrate",,Train
NYSEDREGENTS_2004_8_41,41,1,1,1,1,NYSEDREGENTS,8,2004,The diagram below shows a pinwheel rotating above a lit candle. The arrows indicate the direction of air flow. {img:images/NYSEDREGENTS/2004_8th_Grade/43.PNG} Which energy transformation is best shown in this diagram? (1) heat to mechanical (2) mechanical to light (3) sound to heat (4) heat to sound,,Train
NYSEDREGENTS_2004_8_42,42,1,2,1,1,NYSEDREGENTS,8,2004,"The diagram below shows four objects and their orbits around the Sun, as seen from space. {img:images/NYSEDREGENTS/2004_8th_Grade/44.PNG} Which statement is true about all of the objects shown in the diagram? (1) They produce their own light. (2) They belong to our solar system. (3) They are composed mostly of gases. (4) They are the same distance from the Sun.",,Train
NYSEDREGENTS_2004_8_43,43,1,4,1,1,NYSEDREGENTS,8,2004,Base your answers on the diagrams below and your knowledge of science. The diagrams show liquid water changing to water vapor in four different situations. {img:images/NYSEDREGENTS/2004_8th_Grade/45.PNG} Which observation would be evidence that the water is undergoing a phase change? (1) Waves form on the top of the pond. (2) Water soaks into the wet sand. (3) The water splashes out of the swimming pool. (4) The water level in the glass of water decreases.,,Train
NYSEDREGENTS_2004_8_44,44,1,2,1,1,NYSEDREGENTS,8,2004,Base your answers on the diagrams below and your knowledge of science. The diagrams show liquid water changing to water vapor in four different situations. {img:images/NYSEDREGENTS/2004_8th_Grade/45.PNG} How is heat energy transferred within the liquid water in the pond? (1) compound formation (2) convection currents (3) chemical reactions (4) nuclear reactions,,Train
NYSEDREGENTS_2004_8_45,45,1,4,1,1,NYSEDREGENTS,8,2004,The drawing below shows a person about to lift a book using a ruler and pencil. {img:images/NYSEDREGENTS/2004_8th_Grade/46.PNG} This drawing illustrates an example of which simple machine? (1) gear (2) pulley (3) balance (4) lever,,Train
NYSEDREGENTS_2004_8_6,6,1,4,1,1,NYSEDREGENTS,8,2004,The diagram below represents a magnified view of an air sac in the human lung. The white arrows indicate blood flow. {img:images/NYSEDREGENTS/2004_8th_Grade/02.PNG} Which two systems are interacting in this diagram? (1) skeletal and muscular (2) nervous and endocrine (3) reproductive and digestive (4) respiratory and circulatory,,Train
NYSEDREGENTS_2004_8_7,7,1,2,1,1,NYSEDREGENTS,8,2004,The diagram below represents a bean seed that has been cut in half to show its various structures. {img:images/NYSEDREGENTS/2004_8th_Grade/03.PNG} Which letter represents the stored food that the new plant will use for early development? (1) A (2) B (3) C (4) D,,Train
NYSEDREGENTS_2004_8_8,8,1,4,1,1,NYSEDREGENTS,8,2004,Base your answers on the drawings of bird feet and the dichotomous key below. {img:images/NYSEDREGENTS/2004_8th_Grade/04.PNG} Bird B is correctly identified as (1) a cormorant (2) a duck (3) an eagle (4) a jacana,,Train
NYSEDREGENTS_2004_8_9,9,1,2,1,1,NYSEDREGENTS,8,2004,Base your answers on the drawings of bird feet and the dichotomous key below. {img:images/NYSEDREGENTS/2004_8th_Grade/04.PNG} What is a common feature of both the eagle and the kingfisher? (1) claws large (2) claws curved (3) three toes webbed together (4) four toes webbed together,,Train
NYSEDREGENTS_2005_8_10,10,1,2,1,1,NYSEDREGENTS,8,2005,The diagram below shows an incomplete circuit. {img:images/NYSEDREGENTS/2005_8th_Grade/04.PNG} Which item would allow the bulb to light up if it were used to connect point A to point B? (1) a glass rod (2) a metal coin (3) a plastic comb (4) a paper cup,,Train
NYSEDREGENTS_2005_8_11,11,1,4,1,1,NYSEDREGENTS,8,2005,The diagram below shows milk being poured into a measuring cup. {img:images/NYSEDREGENTS/2005_8th_Grade/05.PNG} Which property of the milk can be directly measured using the cup? (1) mass (2) density (3) solubility (4) volume,,Train
NYSEDREGENTS_2005_8_13,13,1,1,1,1,NYSEDREGENTS,8,2005,Which setup below would require the least force to lift a 100-gram mass a distance of 10 centimeters? (1) {img:images/NYSEDREGENTS/2005_8th_Grade/06.PNG} (2) {img:images/NYSEDREGENTS/2005_8th_Grade/07.PNG} (3) {img:images/NYSEDREGENTS/2005_8th_Grade/08.PNG} (4) {img:images/NYSEDREGENTS/2005_8th_Grade/09.PNG},,Train
NYSEDREGENTS_2005_8_16,16,1,3,1,1,NYSEDREGENTS,8,2005,The drawing below shows the original size and shape of a rock sample before it is thrown into a rapidly moving stream. {img:images/NYSEDREGENTS/2005_8th_Grade/10.PNG} Which drawing best shows the actual size and shape the rock will have after being carried several hundred miles downstream and deposited? (1) {img:images/NYSEDREGENTS/2005_8th_Grade/11.PNG} (2) {img:images/NYSEDREGENTS/2005_8th_Grade/12.PNG} (3) {img:images/NYSEDREGENTS/2005_8th_Grade/13.PNG} (4) {img:images/NYSEDREGENTS/2005_8th_Grade/14.PNG},,Train
NYSEDREGENTS_2005_8_17,17,1,4,1,1,NYSEDREGENTS,8,2005,The diagram below shows stages in the development of a certain landscape. {img:images/NYSEDREGENTS/2005_8th_Grade/15.PNG} When did erosion become the most dominant process in the development of the landscape shown in stage 4? (1) at stage 1 (2) at stage 2 (3) between stages 2 and 3 (4) between stages 3 and 4,,Train
NYSEDREGENTS_2005_8_18,18,1,2,1,1,NYSEDREGENTS,8,2005,The diagram below shows a cross section of rock layers in Earth's crust. {img:images/NYSEDREGENTS/2005_8th_Grade/16.PNG} The forces shown in the diagram caused the rock layers to (1) fault (2) fold (3) form (4) expand,,Train
NYSEDREGENTS_2005_8_19,19,1,3,1,1,NYSEDREGENTS,8,2005,The graph below shows tide levels for two days at an ocean location. {img:images/NYSEDREGENTS/2005_8th_Grade/17.PNG} Approximately how many hours are between the high tide on Tuesday and the first high tide on Wednesday? (1) 6 hours (2) 9 hours (3) 12 hours (4) 18 hours,,Train
NYSEDREGENTS_2005_8_2,2,1,4,1,1,NYSEDREGENTS,8,2005,The diagram below shows four Moon phases observed during July. {img:images/NYSEDREGENTS/2005_8th_Grade/01.PNG} On which date would the next New Moon occur? (1) August 5 (2) August 10 (3) August 19 (4) August 29,,Train
NYSEDREGENTS_2005_8_20,20,1,3,1,1,NYSEDREGENTS,8,2005,The map below shows the relative size and track of a certain weather event. {img:images/NYSEDREGENTS/2005_8th_Grade/18.PNG} Which weather event is shown on the map? (1) tornado (2) blizzard (3) hurricane (4) thunderstorm,,Train
NYSEDREGENTS_2005_8_21,21,1,1,1,1,NYSEDREGENTS,8,2005,"Base your answers on the diagram below, which shows two insulated Styrofoam cups of water connected by an aluminum bar. The thermometers show the temperature of the water in cup A and cup B at the beginning of a heat-flow experiment. {img:images/NYSEDREGENTS/2005_8th_Grade/19.PNG} Over the next 15 minutes, which changes would most likely occur? (1) The temperature in cup A will decrease and the temperature in cup B will increase. (2) The temperature in cup A will decrease and the temperature in cup B will decrease. (3) The temperature in cup A will increase and the temperature in cup B will increase. (4) The temperature in cup A will increase and the temperature in cup B will decrease.",,Train
NYSEDREGENTS_2005_8_22,22,1,2,1,1,NYSEDREGENTS,8,2005,"Base your answers on the diagram below, which shows two insulated Styrofoam cups of water connected by an aluminum bar. The thermometers show the temperature of the water in cup A and cup B at the beginning of a heat-flow experiment. {img:images/NYSEDREGENTS/2005_8th_Grade/19.PNG} Which process is most responsible for the temperature changes that will take place? (1) radiation of heat from the water in the cups to the thermometers (2) conduction of heat through the aluminum bar (3) radiation of heat from the water in the cups into the air (4) conduction of heat through the air to the water in the cups",,Train
NYSEDREGENTS_2005_8_23,23,1,2,1,1,NYSEDREGENTS,8,2005,"The map below shows an air mass that formed over the Gulf of Mexico at location A. {img:images/NYSEDREGENTS/2005_8th_Grade/20.PNG} Once air mass A reaches location B, the weather conditions at location B will most likely become (1) warmer and drier (2) warmer and more humid (3) colder and more humid (4) colder and drier",,Train
NYSEDREGENTS_2005_8_24,24,1,4,1,1,NYSEDREGENTS,8,2005,"The diagram below shows a pencil in a glass of water. {img:images/NYSEDREGENTS/2005_8th_Grade/21.PNG} When viewed from the side, the pencil appears to be broken. What process causes this to happen? (1) absorption (2) evaporation (3) reflection (4) refraction",,Train
NYSEDREGENTS_2005_8_25,25,1,4,1,1,NYSEDREGENTS,8,2005,The cross section below shows fossils and the rock layers in which they are found. Crustal movement has not displaced the rock layers. {img:images/NYSEDREGENTS/2005_8th_Grade/22.PNG} Which fossil is considered the oldest in the cross section shown? (1) armored fish (2) dinosaurs (3) early horses (4) trilobites,,Train
NYSEDREGENTS_2005_8_27,27,1,1,1,1,NYSEDREGENTS,8,2005,The diagram below shows a human body system. {img:images/NYSEDREGENTS/2005_8th_Grade/23.PNG} What are two of the functions performed by this body system? (1) protects and supports the body (2) produces and transports oxygen within the body (3) produces and excretes waste products (4) controls and coordinates body activities,,Train
NYSEDREGENTS_2005_8_31,31,1,2,1,1,NYSEDREGENTS,8,2005,The labeled organs in the diagram below are part of which human body system? {img:images/NYSEDREGENTS/2005_8th_Grade/24.PNG} (1) respiratory (2) endocrine (3) digestive (4) circulatory,,Train
NYSEDREGENTS_2005_8_34,34,1,3,1,1,NYSEDREGENTS,8,2005,Base your answers on the diagram below which shows a model of human inheritance. {img:images/NYSEDREGENTS/2005_8th_Grade/25.PNG} The parent whose genes are aa (1) must be dominant (2) has a straight hairline (3) has a peaked hairline (4) may have AA offspring,,Train
NYSEDREGENTS_2005_8_35,35,1,1,1,1,NYSEDREGENTS,8,2005,Base your answers on the diagram below which shows a model of human inheritance. {img:images/NYSEDREGENTS/2005_8th_Grade/25.PNG} The diagram shown is called a (1) Punnett square (2) pedigree chart (3) dichotomous key (4) flowchart,,Train
NYSEDREGENTS_2005_8_38,38,1,1,1,1,NYSEDREGENTS,8,2005,The table below shows the symptoms of some diseases that are caused by bacteria. {img:images/NYSEDREGENTS/2005_8th_Grade/26.PNG} Which two diseases listed in the table affect the digestive system? (1) botulism and typhoid fever (2) botulism and pneumonia (3) tetanus and pneumonia (4) tetanus and typhoid fever,,Train
NYSEDREGENTS_2005_8_39,39,1,3,1,1,NYSEDREGENTS,8,2005,"Base your answers on the diagram below, which shows a partial food web. {img:images/NYSEDREGENTS/2005_8th_Grade/27.PNG} How many organisms in this food web feed on the mice? (1) 5 (2) 2 (3) 3 (4) 4",,Train
NYSEDREGENTS_2005_8_40,40,1,4,1,1,NYSEDREGENTS,8,2005,"Base your answers on the diagram below, which shows a partial food web. {img:images/NYSEDREGENTS/2005_8th_Grade/27.PNG} Which group of organisms is missing from this food web? (1) carnivores (2) herbivores (3) omnivores (4) decomposers",,Train
NYSEDREGENTS_2005_8_42,42,1,4,1,1,NYSEDREGENTS,8,2005,The diagram below shows changes that a butterfly undergoes as it develops from an egg into an adult. {img:images/NYSEDREGENTS/2005_8th_Grade/28.PNG} Which process is illustrated in the diagram? (1) mutation (2) photosynthesis (3) germination (4) metamorphosis,,Train
NYSEDREGENTS_2005_8_7,7,1,2,1,1,NYSEDREGENTS,8,2005,Which title best describes the processes shown in the diagram below? {img:images/NYSEDREGENTS/2005_8th_Grade/02.PNG} (1) The Rock Cycle (2) The Water Cycle (3) Plate Tectonics (4) Chemical Changes,,Train
NYSEDREGENTS_2005_8_8,8,1,2,1,1,NYSEDREGENTS,8,2005,The diagram below shows a penny scratching the surface of the mineral calcite. {img:images/NYSEDREGENTS/2005_8th_Grade/03.PNG} Which physical property of the calcite is being tested? (1) streak (2) hardness (3) melting point (4) reaction to acid,,Train
NYSEDREGENTS_2006_8_13,13,1,4,1,1,NYSEDREGENTS,8,2006,The diagram below shows the geometric structure of a molecule of water (H2O). {img:images/NYSEDREGENTS/2006_8th_Grade/05.PNG} What do the symbols {img:images/NYSEDREGENTS/2006_8th_Grade/06.PNG} and {img:images/NYSEDREGENTS/2006_8th_Grade/07.PNG} represent in the model? (1) genetic material (2) chemical bonds (3) cells (4) atoms,,Train
NYSEDREGENTS_2006_8_14,14,1,1,1,1,NYSEDREGENTS,8,2006,"Base your answers on the weather map below, which shows a typical low-pressure system located over part of North America in May. The numbers on the map indicate the air temperature in degrees Fahrenheit. {img:images/NYSEDREGENTS/2006_8th_Grade/08.PNG} The fronts shown on the weather map are best described as (1) boundaries between different air masses (2) boundaries between different wind belts (3) areas experiencing clear skies with light winds (4) areas experiencing extremely warm air temperatures",,Train
NYSEDREGENTS_2006_8_15,15,1,1,1,1,NYSEDREGENTS,8,2006,"Base your answers on the weather map below, which shows a typical low-pressure system located over part of North America in May. The numbers on the map indicate the air temperature in degrees Fahrenheit. {img:images/NYSEDREGENTS/2006_8th_Grade/08.PNG} The symbol {img:images/NYSEDREGENTS/2006_8th_Grade/56.PNG} shown on the map best represents (1) the probable direction of storm movement for the next 12 hours (2) ocean currents moving the storm system toward the east (3) convection currents associated with the storm system (4) the beginning location of the storm system",,Train
NYSEDREGENTS_2006_8_16,16,1,4,1,1,NYSEDREGENTS,8,2006,"The data table below shows the mass of an 800-gram block of ice as it melts to a 600-gram block of ice. {img:images/NYSEDREGENTS/2006_8th_Grade/09.PNG} If the current rate of melting continues, how many more minutes will be required for the 600-gram block of ice to reach a mass of 400 grams? (1) 15 (2) 30 (3) 45 (4) 60",,Train
NYSEDREGENTS_2006_8_17,17,1,2,1,1,NYSEDREGENTS,8,2006,The diagrams below show a natural process that weathers rock. {img:images/NYSEDREGENTS/2006_8th_Grade/10.PNG} Which statement best explains why this process results in weathering? (1) Frozen water acts as a solute. (2) Water expands when it freezes. (3) The mass of water increases when it freezes. (4) Frozen water dissolves most types of rocks.,,Train
NYSEDREGENTS_2006_8_18,18,1,3,1,1,NYSEDREGENTS,8,2006,Which graph shows that more grams of a substance can be dissolved in water as the water temperature increases? (1) {img:images/NYSEDREGENTS/2006_8th_Grade/11.PNG} (2) {img:images/NYSEDREGENTS/2006_8th_Grade/12.PNG} (3) {img:images/NYSEDREGENTS/2006_8th_Grade/13.PNG} (4) {img:images/NYSEDREGENTS/2006_8th_Grade/14.PNG},,Train
NYSEDREGENTS_2006_8_19,19,1,4,1,1,NYSEDREGENTS,8,2006,"Letters A, B, C, and D represent locations on a bar magnet. {img:images/NYSEDREGENTS/2006_8th_Grade/15.PNG} Which location has the greatest magnetic force? (1) A (2) B (3) C (4) D",,Train
NYSEDREGENTS_2006_8_2,2,1,1,1,1,NYSEDREGENTS,8,2006,The streaks in the time-lapse photograph below show the apparent motion of the stars around the North Star during one hour. {img:images/NYSEDREGENTS/2006_8th_Grade/01.PNG} This apparent motion of the stars can best be explained by Earth's (1) rotation on its axis (2) tilted axis (3) revolution around the North Star (4) changing distance from the North Star,,Train
NYSEDREGENTS_2006_8_20,20,1,2,1,1,NYSEDREGENTS,8,2006,The diagram below represents several forms of electromagnetic energy. {img:images/NYSEDREGENTS/2006_8th_Grade/16.PNG} Which feature best distinguishes one form of electromagnetic energy from another? (1) color (2) wavelength (3) surface temperature (4) distance traveled,,Train
NYSEDREGENTS_2006_8_21,21,1,4,1,1,NYSEDREGENTS,8,2006,Which instrument could be used to determine the volume of an irregularly shaped solid? (1) {img:images/NYSEDREGENTS/2006_8th_Grade/17.PNG} (2) {img:images/NYSEDREGENTS/2006_8th_Grade/18.PNG} (3) {img:images/NYSEDREGENTS/2006_8th_Grade/19.PNG} (4) {img:images/NYSEDREGENTS/2006_8th_Grade/20.PNG},,Train
NYSEDREGENTS_2006_8_22,22,1,2,1,1,NYSEDREGENTS,8,2006,The drawings below show four animals. {img:images/NYSEDREGENTS/2006_8th_Grade/21.PNG} What do all four animals have in common? (1) They reproduce asexually. (2) They are composed of cells. (3) They have similar means of locomotion. (4) They have the same internal structures.,,Train
